property_name,reviewer,date,stars,heading,reviewThe Royal Castle,Guest User,19/09/2020,5,The Royal Castle.,"Amarprakash Developers Pvt. Ltd. has launched The Royal Castle, a residential housing project located in Chennai. The Apartment is very spacious and of different sizes. The Royal Castle is in close proximity to many reputed schools and hospitals. This is in a prime area, with many attractions work a... Read More"
The Royal Castle,Guest User,19/09/2020,5,The Royal Castle.,"Amarprakash Developers Pvt. Ltd. has launched The Royal Castle, a residential housing project located in Chennai. The Apartment is very spacious and of different sizes. The Royal Castle is in close proximity to many reputed schools and hospitals. This is in a prime area, with many attractions work a... Read More"
The Royal Castle,Gunasekar,29/04/2014,4,Chromepet.,?
TVS Emerald LightHouse,Srini,14/09/2013,5,Pallavaram.,?
Malles Arcadiaa,Suresh babu,27/07/2015,5,Velachery.,?
Gokul Flats,Harsha,03/08/2015,3,T Nagar.,?
Appaswamy Greensville,Guest User,28/08/2020,5,Very good project.,"It is a very nice project in Chennai. The project comes with a gymnasium, swimming pool, a play area for kids, clubhouse, party hall, indoor games facilities, rainwater harvesting facilities and intercom facilities. The amenities are enjoyable and helpful to engage kids."
Appaswamy Greensville,Guest User,28/08/2020,5,Very good project.,"It is a very nice project in Chennai. The project comes with a gymnasium, swimming pool, a play area for kids, clubhouse, party hall, indoor games facilities, rainwater harvesting facilities and intercom facilities. The amenities are enjoyable and helpful to engage kids."
Appaswamy Greensville,Gopi,18/10/2014,5,Sholinganallur.,?
Adroit Artistica,Guest User,12/07/2020,4,Very nice project,This apartment located in sholiganallur.This apartment amenities have covered car parking security play area and near by branded shops available.
Adroit Artistica,Guest User,12/07/2020,4,Very nice project,This apartment located in sholiganallur.This apartment amenities have covered car parking security play area and near by branded shops available.
Adroit Artistica,Rajesh,03/12/2013,5,Sholinganallur is a very good place in Chennai.,?
Deccan Kalpataru,Sathiyabhama,27/01/2014,5,Sholinganallur.,?
VGN Stafford,Guest User,22/05/2021,4,Good project.,VGN Stafford is a good residential project. It is a good and peaceful place to live with family. Well-maintained project. All amenities are available in this project.
VGN Stafford,Guest User,22/05/2021,5,Nice project.,"This is under construction project possession will start from April 26. All amenities to fulfill the needs of residents with international schools, colleges, lifestyle malls, recreation parks, and hospitals being nearby."
VGN Stafford,Guest User,22/05/2021,4,Good project.,VGN Stafford is a good residential project. It is a good and peaceful place to live with family. Well-maintained project. All amenities are available in this project.
VGN Stafford,Guest User,22/05/2021,5,Nice project.,"This is under construction project possession will start from April 26. All amenities to fulfill the needs of residents with international schools, colleges, lifestyle malls, recreation parks, and hospitals being nearby."
VGN Stafford,Guest User,26/12/2020,4,Nice Location.,VGN Stafford is good Project. Very luxurious project good Place to live life. Well maintained project. Good security staff
VGN Stafford,Guest User,21/12/2020,4,Best project.,"The project is in a prime location, good high rise towers, positive is location, brand name, good repot to complete the project on time. All amenity is available in this project."
VGN Stafford,Rathna,20/05/2014,5,Ambattur.,?
Lancor Abode Valley,Guest User,19/09/2020,5,Nice place,"A nice place to live with your friends if you are a SRM student. The flats are well furnished having all the amenities. It has a swimming pool, Gym, ground and indoor badminton court quite enjoyable for us."
Lancor Abode Valley,Guest User,19/09/2020,5,Nice place,"A nice place to live with your friends if you are a SRM student. The flats are well furnished having all the amenities. It has a swimming pool, Gym, ground and indoor badminton court quite enjoyable for us."
Lancor Abode Valley,Karthika,08/01/2013,0,Review Of Potheri,?
Akila Heights,Guest User,06/12/2020,4,close to hospital,"Akila Height societys is close to Government Hospital located in Sembakkam Chennai. Good flates with nice interiors nd also available a park nd garden, best apartments and friendly people."
Akila Heights,Guest User,04/12/2020,4,The Prime Project,"Very Recently have visited this project, it is constructed with a long delay by th developers, but the handover is expected after very soon. This is Very Prime Location and all facilities available."
Akila Heights,Guest User,06/12/2020,4,close to hospital,"Akila Height societys is close to Government Hospital located in Sembakkam Chennai. Good flates with nice interiors nd also available a park nd garden, best apartments and friendly people."
Akila Heights,Guest User,04/12/2020,4,The Prime Project,"Very Recently have visited this project, it is constructed with a long delay by th developers, but the handover is expected after very soon. This is Very Prime Location and all facilities available."
Akila Heights,Vinodh,05/04/2014,4,Sembakkam is a good place of Chennai.,?
Kochar Panchsheel,Raghunathan,26/03/2016,4,Ambattur.,?
RC Royal Grande,Rajesh,23/06/2012,0,Review Of Thirumullaivayal,?
OMR IT Avenue,Rajan,28/07/2014,5,Vandalur.,?
Barefoot Bay,Suresh,28/12/2012,0,Review Of E.C.R Road,?
Akshaya Metropolis,Guest User,25/10/2020,4,Nice project.,"It is a luxurious residential project. The project comes in with excellent amenities for its residents, like a Gymnasium, Swimming pool, Clubhouse, Multipurpose Room, Sports facility, etc."
Akshaya Metropolis,Guest User,22/10/2020,5,Nice project.,"This is an ultimate reflection of the urban chic lifestyle located in Maraimalai Nagar, Chennai. The project hosts in its lap exclusively designed residential apartments, each being an epitome of elegance and simplicity."
Akshaya Metropolis,Guest User,25/10/2020,4,Nice project.,"It is a luxurious residential project. The project comes in with excellent amenities for its residents, like a Gymnasium, Swimming pool, Clubhouse, Multipurpose Room, Sports facility, etc."
Akshaya Metropolis,Guest User,22/10/2020,5,Nice project.,"This is an ultimate reflection of the urban chic lifestyle located in Maraimalai Nagar, Chennai. The project hosts in its lap exclusively designed residential apartments, each being an epitome of elegance and simplicity."
Akshaya Metropolis,Guest User,13/08/2020,4,Excellent project.,This area is good location. School and market are available in the location. This apartment indoor games and kids play area are available in the project.
Akshaya Metropolis,Chukkala,12/12/2012,0,Review Of Maraimalai Nagar,?
Sare Crescent Parc Dewy Terraces,Kasthuri,04/05/2016,5,Thiruporur.,?
Casagrand Asta,Guest User,24/09/2020,4,Nice Atmosphere.,Good community and nice location or 15 mins from koyambedu. Nice atmosphere and ventilation for every home. Excellently designed project. The rooms are spacious. Accessible for my kid's school. The salesperson is friendly and answered all my queries. The right investment is made in the right place.
Casagrand Asta,Guest User,22/08/2020,5,Nice project.,"This apartment located in Korattur. It has amenities that have car parking, security, kids play area and nearby shops, school and market available."
Casagrand Asta,Guest User,24/09/2020,4,Nice Atmosphere.,Good community and nice location or 15 mins from koyambedu. Nice atmosphere and ventilation for every home. Excellently designed project. The rooms are spacious. Accessible for my kid's school. The salesperson is friendly and answered all my queries. The right investment is made in the right place.
Casagrand Asta,Guest User,22/08/2020,5,Nice project.,"This apartment located in Korattur. It has amenities that have car parking, security, kids play area and nearby shops, school and market available."
Casagrand Asta,Ravi,22/05/2013,5,Near to Railway Station.,?
Asvini Amanya Phase I,Babu,24/05/2014,4,Guduvancheri.,?
Courtyard Hygrevar,Gopisrinivasalu,07/11/2011,0,Review Of G S T Road,?
Vijay Shanthi Apartment,Kalaiyarasan,09/07/2014,4,Kelambakkam.,?
Sidharth Upscale,Guest User,18/03/2021,4,Nice project.,This is well maintained residential project equipped with all modern amenities to facilitate the needs of residents. Only 6 km from Chennai Airport. All the basic facilities like groceries store and supermarkets are available nearby.
Sidharth Upscale,Guest User,02/11/2020,5,Good project.,"Sidharth Upscale Primed to take luxury living to higher-level Sidharth Upscale is a stylishly designed opulent apartment tower. That nestles majestically in an attractively landscaped site area in the premium environs of Porur 388 Ultra-luxurious one, two, three, four-bedroom apartments sizes."
Sidharth Upscale,Guest User,18/03/2021,4,Nice project.,This is well maintained residential project equipped with all modern amenities to facilitate the needs of residents. Only 6 km from Chennai Airport. All the basic facilities like groceries store and supermarkets are available nearby.
Sidharth Upscale,Guest User,02/11/2020,5,Good project.,"Sidharth Upscale Primed to take luxury living to higher-level Sidharth Upscale is a stylishly designed opulent apartment tower. That nestles majestically in an attractively landscaped site area in the premium environs of Porur 388 Ultra-luxurious one, two, three, four-bedroom apartments sizes."
Sidharth Upscale,Kalai,13/05/2014,5,Porur.,?
Ruby Elite,Guest User,20/05/2021,4,Nice project.,The beautiful backdrop provides excellent natural sight and fresh air to reenergize life. You will also find a fresh environment in society. There are two tallest blocks in society with luxurious amenities.
Ruby Elite,Guest User,19/05/2021,5,Beautiful Project.,Ruby Elite offers 2BHK and 3 BHK Apartments in Chennai. Which is available from 1040 Sq-ft to 2231 Sq-ft. With many luxurious amenities.
Ruby Elite,Guest User,20/05/2021,4,Nice project.,The beautiful backdrop provides excellent natural sight and fresh air to reenergize life. You will also find a fresh environment in society. There are two tallest blocks in society with luxurious amenities.
Ruby Elite,Guest User,19/05/2021,5,Beautiful Project.,Ruby Elite offers 2BHK and 3 BHK Apartments in Chennai. Which is available from 1040 Sq-ft to 2231 Sq-ft. With many luxurious amenities.
Ruby Elite,Guest User,18/05/2021,4,Nice project.,"Ruby Elite offers good facilities for residents. Also offers many luxurious amenities. Like pool, gym, banquet hall, etc. Security is tight in society. It is an overall good society."
Ruby Elite,Barani,20/06/2015,4,Medavakkam.,?
MF Aditya,Arun kumar,17/07/2015,5,Pallikaranai.,?
Alliance Orchid Springss,Ranganathan,23/05/2013,5,Korattur peaceful locality and well connected by road and rail major industrial are nearby.,?
Casagrand Zenith,Guest User,21/05/2021,3,Nice project.,This is a nice and prime site. Project id under construction. Went to book a flat. The view from the drawing and bedrooms is great. Place worth investing. 
Casagrand Zenith,Guest User,20/08/2020,4,Good project.,"It offers 2, 3, and 4 BHK skillfully design apartments. For comfort of living with all the modern amenities and lush green environment for a healthy lifestyle. School, colleges, hospitals and the market is nearby. Road conditions are good."
Casagrand Zenith,Guest User,21/05/2021,3,Nice project.,This is a nice and prime site. Project id under construction. Went to book a flat. The view from the drawing and bedrooms is great. Place worth investing. 
Casagrand Zenith,Guest User,20/08/2020,4,Good project.,"It offers 2, 3, and 4 BHK skillfully design apartments. For comfort of living with all the modern amenities and lush green environment for a healthy lifestyle. School, colleges, hospitals and the market is nearby. Road conditions are good."
Casagrand Zenith,Guest User,19/08/2020,4,Casagrand Zenith.,"Casagrand Zenith is a residential project in Medavakkam by Casagrande. This is under construction project and starting possession in 2022. This project offering 2, 3 and 4 BHK lavish apartments along with all modern-day amenities like swimming pool, basketball court, lush green garden, jogging track... Read More"
Casagrand Zenith,Manavalan,31/07/2014,5,Medavakkam.,?
Akshaya Today,Guest User,24/09/2020,4,Good Project.,This project offers all major amenities and great feelings about the ambiance. It is having compact apartments and decent built-in quality.
Akshaya Today,Guest User,19/08/2020,1,Nice project.,"This project was started in 2013 January and expected to handed over by 2015 January. But this is still not happening, but he has put his hands on other projects leaving this."
Akshaya Today,Guest User,24/09/2020,4,Good Project.,This project offers all major amenities and great feelings about the ambiance. It is having compact apartments and decent built-in quality.
Akshaya Today,Guest User,19/08/2020,1,Nice project.,"This project was started in 2013 January and expected to handed over by 2015 January. But this is still not happening, but he has put his hands on other projects leaving this."
Akshaya Today,kanhaiya kr,12/07/2020,5,Akshaya Today_Kelambakkam,This apartment located in kelambakkam.This apartment amenities have swimming pool car parking kids play area and security
Akshaya Today,Nazneen Farid,14/09/2017,5,Kelambakkam,?
TVH Ouranya Bay,Guest User,30/09/2020,5,Nice project.,"One of the tallest apartments in the area. Very beautiful, with the necessary amenities. Great view of the Sea and the city, nearby shops are there. It has a helicopter pad as well. The well-ventilated area with a swimming pool, gym, etc. It is a very tall building with 28 floors."
TVH Ouranya Bay,Guest User,25/09/2020,5,Good Society.,"Great society and a good community. Though there are no shops near the apartments. There is a grocery and vegetable shop too within the society on the ground floor. Almost everything needed is available in the shop. Good maintenance and there is a beach view from the top floors of the apartment, Kov... Read More"
TVH Ouranya Bay,Guest User,30/09/2020,5,Nice project.,"One of the tallest apartments in the area. Very beautiful, with the necessary amenities. Great view of the Sea and the city, nearby shops are there. It has a helicopter pad as well. The well-ventilated area with a swimming pool, gym, etc. It is a very tall building with 28 floors."
TVH Ouranya Bay,Guest User,25/09/2020,5,Good Society.,"Great society and a good community. Though there are no shops near the apartments. There is a grocery and vegetable shop too within the society on the ground floor. Almost everything needed is available in the shop. Good maintenance and there is a beach view from the top floors of the apartment, Kov... Read More"
TVH Ouranya Bay,Guest User,23/08/2020,4,Good project,This apartment is located in Padur. This apartment amenities have car parking rainwater harvesting security Vaastu and nearby market shops available.
TVH Ouranya Bay,Senthil ,23/05/2015,5,Padur.,?
Radiance Shine,Guest User,14/05/2021,5,Beautiful Project.,"The project hosts in its lap exclusively designed residential apartments, each being an epitome of elegance and simplicity."
Radiance Shine,Guest User,14/05/2021,5,Beautiful Project.,"Radiance Shine offers 1 BHK, 2 BHK, and 3 BHK luxurious Apartments in Chennai. The master plan of Radiance Shine ensures that these Apartments in Old Mahabalipuram Road are Vastu compliant."
Radiance Shine,Guest User,14/05/2021,5,Beautiful Project.,"The project hosts in its lap exclusively designed residential apartments, each being an epitome of elegance and simplicity."
Radiance Shine,Guest User,14/05/2021,5,Beautiful Project.,"Radiance Shine offers 1 BHK, 2 BHK, and 3 BHK luxurious Apartments in Chennai. The master plan of Radiance Shine ensures that these Apartments in Old Mahabalipuram Road are Vastu compliant."
Radiance Shine,malathi,14/12/2014,5,Old Mahabalipuram Road.,?
VGN Mahalakshmi Nagar,Guest User,07/02/2021,4,nice surroundings,"Nice project offers land, location is good with good greenry and nice surroundings, it has all the facilites available."
VGN Mahalakshmi Nagar,Guest User,05/01/2021,5,Well located,"Nice project offers land, it has good green area and open space, all the facilities are available, it is under development as of now as houses are to be constructed by Land Owner.	"
VGN Mahalakshmi Nagar,Guest User,07/02/2021,4,nice surroundings,"Nice project offers land, location is good with good greenry and nice surroundings, it has all the facilites available."
VGN Mahalakshmi Nagar,Guest User,05/01/2021,5,Well located,"Nice project offers land, it has good green area and open space, all the facilities are available, it is under development as of now as houses are to be constructed by Land Owner.	"
VGN Mahalakshmi Nagar,Uma,14/11/2012,0,Review Of Vellappanchavadi,?
Nova,Guest User,22/05/2021,5,Good project.,It is the best residential apartment with cool greenery outside. It is well security maintained area. Very close to the railway station. Good to middle-class families. Rooms are small and the flat is well maintained.
Nova,Guest User,21/05/2021,5,Good project.,"It is the best residential apartment with cool greenery outside. Well, security maintained area. It is very close to the railway station. Good to middle-class families. Rooms are small and the flat is well maintained."
Nova,Guest User,22/05/2021,5,Good project.,It is the best residential apartment with cool greenery outside. It is well security maintained area. Very close to the railway station. Good to middle-class families. Rooms are small and the flat is well maintained.
Nova,Guest User,21/05/2021,5,Good project.,"It is the best residential apartment with cool greenery outside. Well, security maintained area. It is very close to the railway station. Good to middle-class families. Rooms are small and the flat is well maintained."
Nova,Guest User,20/05/2021,5,Good project.,"It is a good apartment for families with 24/7 security, lift facilities are there. Spacious rooms and very well maintained, Too close to Mahindra world school. There were a lot of places for children to play."
Nova,Guest User,19/05/2021,5,Good project.,"It is a good apartment for families with 24/7 security, lift facilities are there. Spacious rooms and very well maintained, Too close to Mahindra world School. There were a lot of places for children to play."
Nova,Lydia ,18/01/2013,0,Review Of Mahendra city,?
Pragnya Eden Park,Guest User,19/06/2021,4,Nice project.,The awesome atmosphere in the project with solid build quality very nice project with good connectivity for it. It has all amenities and facilities nice ventilated flats.
Pragnya Eden Park,Pavan ,19/06/2021,4,Nice project.,Good society has good amenities and facilities. It is well maintained clean and neat society. Good connectivity for transportation also CCTV around. The apartment is a very safe and secure place.
Pragnya Eden Park,Guest User,19/06/2021,4,Nice project.,The awesome atmosphere in the project with solid build quality very nice project with good connectivity for it. It has all amenities and facilities nice ventilated flats.
Pragnya Eden Park,Pavan ,19/06/2021,4,Nice project.,Good society has good amenities and facilities. It is well maintained clean and neat society. Good connectivity for transportation also CCTV around. The apartment is a very safe and secure place.
Pragnya Eden Park,Guest User,09/06/2021,4,Nice project.,"Pragnya Eden Park is a well-planned ready-to-move project developed by Pragnya South City projects Pvt Ltd situated at Siruseri Chennai. It is a good location which has great connectivity to the national highway, railway station, schools, hospital, banks, markets, and other shopping destination. The... Read More"
Pragnya Eden Park,Guest User,06/01/2021,4,Nice project.,"The apartment design is very good. It has a play area, clubhouse, parking lounge, park, swimming pool, and garden. Surrounded by lush greenery, fresh air, no air pollution. School, retail store, the hospital also near by."
Pragnya Eden Park,Guest User,06/01/2021,4,Beautiful project.,"It is a very nice gated community society with all modern facilities. Society located very near to SIPCOT IT Park. Flats design is very good. It has a clubhouse, gym, swimming pool, and garden. It is quiet a place to live."
Pragnya Eden Park,Guest User,20/12/2020,4,Nice Location.,Pragnya Eden Park nice project. Good Amenities and well maintained project. Good Facilities available.
Pragnya Eden Park,Guest User,19/12/2020,4,Pragnya Eden Park.,"The apartment design is very good. It has a play area, clubhouse, parking lounge, park, swimming pool, and garden. The distance between the two blocks is having a good distance. So there is no problem with aeration and lighting. All amenities are here. Good parking Good security and good lift."
Pragnya Eden Park,Guest User,06/08/2020,5,Pragnya Eden Park.,Pragnya Eden Park is very nice project. This area is good location. School and market are available in the location. This apartment indoor games and kids play area are available in the location.
Pragnya Eden Park,Rajendran,24/03/2013,0,Review Of Siruseri,?
Pacifica Aurum,Guest User,22/05/2021,4,Nice project.,The apartment is spacious with good interiors and a huge balcony. It is a nice view from the balcony. It has sported them with a good amenities facility available to provide a comfortable life also it is well connected.
Pacifica Aurum,Guest User,21/08/2020,4,Very good project.,This apartment located in Nadur. This apartment amenities have Swimming Pool car parking kids play area security and nearby schools available.
Pacifica Aurum,Guest User,22/05/2021,4,Nice project.,The apartment is spacious with good interiors and a huge balcony. It is a nice view from the balcony. It has sported them with a good amenities facility available to provide a comfortable life also it is well connected.
Pacifica Aurum,Guest User,21/08/2020,4,Very good project.,This apartment located in Nadur. This apartment amenities have Swimming Pool car parking kids play area security and nearby schools available.
Pacifica Aurum,Guest User,19/08/2020,4,Nice feel with all amenities.,"This apartment located in padur. This apartment amenities have swimming pool, car parking, kids play area, security and near by schools available"
Pacifica Aurum,Sankar,15/10/2012,0,Review Of Old Mahabalipuram Rd,?
Real Value Neel Kamal,Guest User,13/08/2020,4,Real Value Neel Kamal.,This apartment located IT hub Places and lots of shops and public transport connectivity available. This apartment amenities available in rain water harvesting very spacious parking available.
Real Value Neel Kamal,Ramkumar,25/11/2014,0,Real Value Neel Kamal.,"It is a worst experience from Real Value promoters on the Neel Kamal project. They took full EMI for some people 3 years and for some people 4 years, and they have not completed even 10%. Only buy if they show you finished flats, otherwise a strict no. There are so many other better builders. I am i... Read More"
Real Value Neel Kamal,Guest User,13/08/2020,4,Real Value Neel Kamal.,This apartment located IT hub Places and lots of shops and public transport connectivity available. This apartment amenities available in rain water harvesting very spacious parking available.
Real Value Neel Kamal,Ramkumar,25/11/2014,0,Real Value Neel Kamal.,"It is a worst experience from Real Value promoters on the Neel Kamal project. They took full EMI for some people 3 years and for some people 4 years, and they have not completed even 10%. Only buy if they show you finished flats, otherwise a strict no. There are so many other better builders. I am i... Read More"
Real Value Neel Kamal,Senthil,06/01/2013,0,Review Of Old Mahabalipuram Rd,?
VGN Brixton,Guest User,17/10/2020,3,Good location,VGN Brixton Chennai Quiet Atmosphere.  Good facilities  The industrial area is very close to dominoes and also good construction and very well sports facilities no rare power cut.
VGN Brixton,Guest User,15/10/2020,0,Good project.,"VGN Brixton peaceful place to live in. Clean and neat parking area. Shopping, restaurant schools are back on the campus. Good power back up and water supply."
VGN Brixton,Guest User,17/10/2020,3,Good location,VGN Brixton Chennai Quiet Atmosphere.  Good facilities  The industrial area is very close to dominoes and also good construction and very well sports facilities no rare power cut.
VGN Brixton,Guest User,15/10/2020,0,Good project.,"VGN Brixton peaceful place to live in. Clean and neat parking area. Shopping, restaurant schools are back on the campus. Good power back up and water supply."
VGN Brixton,Thanagvel,11/11/2013,4,Irungatukottai.,?
VNR Milford,Guest User,07/02/2021,4,Good project,"Nice project has solid build quality and design, roads are good and well connected, kids play area and parking is available."
VNR Milford,Guest User,05/01/2021,4,Beautiful Project,"Nice low rise apartment with great facilities, huge open space and good green area, roads are good and well connected"
VNR Milford,Guest User,07/02/2021,4,Good project,"Nice project has solid build quality and design, roads are good and well connected, kids play area and parking is available."
VNR Milford,Guest User,05/01/2021,4,Beautiful Project,"Nice low rise apartment with great facilities, huge open space and good green area, roads are good and well connected"
